,Unnamed: 0,Unnamed: 0.1,Unnamed: 0.1.1,isbn,title,rating,age,UserID,description,num_pages,image_url,emotion_NRC,emotion_NRC_objective
0,0,121,121,763672939,Shh! We Have a Plan,5.0,3,99,"“A masterful delight, this crafty caper has huge kid appeal and a title/refrain that will easily sneak into the family lexicon: 'Shh! We have a plan.' ” —School Library Journal (starred review) Four friends creep through the woods, and what do they spot? An exquisite bird high in a tree! “Hello birdie,” waves one. “Shh! We have a plan,” hush the others. They stealthily make their advance, nets in the air. Ready one, ready two, ready three, and go! But as one comically foiled plan follows another, it soon become",40,https://images.gr-assets.com/books/1400889912m/20819651.jpg,"{'Anger': 0.0, 'Anticipation': 0.24971958804935246, 'Disgust': 0.01748750892219843, 'Fear': 0.051493830937085754, 'Joy': 0.2826042622616498, 'Sadness': 0.041449984704802684, 'Surprise': 0.09044560008157437, 'Trust': 0.26679922504333636}","{'Anger': 0.009918998884415773, 'Anticipation': 0.15780666440316243, 'Disgust': 0.005674928457098511, 'Fear': 0.030945336372896155, 'Joy': 0.1071203375854877, 'Sadness': 0.0, 'Surprise': 0.04983751273221128, 'Trust': 0.10515593927341516, 'Objective': 0.533540282291313}"
1,1,174,174,670011487,Henry and the Bully ,5.0,3,141,"Favorite author Nancy Carlson tackles the age-old problem of bullying The lovable Henry is back--and he's being bullied on the soccer field at school! When no one's advice seems to help, it's up to Henry to solve his bully problem for himself. Classroom favorite Nancy Carlson encourages young readers to use creativity and empathy to deal with one of childhood's toughest challenges.",0,https://covers.openlibrary.org/b/id/9620484-L.jpg,"{'Anger': 0.2003494467093768, 'Anticipation': 0.15026208503203262, 'Disgust': 0.0, 'Fear': 0.19103086779266157, 'Joy': 0.05824111822947001, 'Sadness': 0.1683168316831683, 'Surprise': 0.0, 'Trust': 0.2317996505532906}","{'Anger': 0.07526476135209634, 'Anticipation': 0.026171478311330338, 'Disgust': 0.0, 'Fear': 0.07842739010590455, 'Joy': 0.12105034092557668, 'Sadness': 0.07572900043522413, 'Surprise': 0.028811838096619764, 'Trust': 0.1303061076454374, 'Objective': 0.46423908312781087}"
2,2,8,8,9781465444578,Sea Otters,5.0,4,8,"Get a close-up look at the lives of sea otters and watch them eat, play, groom, and dive together. Filled with bold, adorable images of these aquatic creatures in their natural habitat, Sea Otters explores a day in the life of these furry, whiskered marine mammals. Perfect for 3–5 year olds learning to read, Level 1 titles contain short, simple sentences with an emphasis on frequently used words. Stunning photographic images with labels provide visual clues to introduce and reinforce vocabulary. Trusted by parents, teachers, and librarians, and loved by kids, DK's leveled reading series is now revised and updated. With shiny new jackets and brand new nonfiction narrative content on the topics kids love, each book is written and reviewed by literacy experts, and contains a glossary and index making them the perfect choice for helping develop strong reading habits for kids ages 3–11.",24,https://covers.openlibrary.org/b/id/9588178-L.jpg,"{'Anger': 0.020142900577683188, 'Anticipation': 0.2083460018242627, 'Disgust': 0.0445424141076315, 'Fear': 0.10785953177257526, 'Joy': 0.23190939495287324, 'Sadness': 0.017786561264822136, 'Surprise': 0.05404378230465187, 'Trust': 0.3153694131955001}","{'Anger': 0.003344397188182289, 'Anticipation': 0.052538586771331566, 'Disgust': 0.007395534914244608, 'Fear': 0.02047023486502518, 'Joy': 0.09631863901964992, 'Sadness': 0.0029531658189987002, 'Surprise': 0.00897308075772682, 'Trust': 0.13912692302838317, 'Objective': 0.6688794376364577}"
3,3,191,191,805068481,Alphabet Under Construction,5.0,4,155,"Mouse is hard at work constructing each letter of the alphabet. He dyes the D, erases the E, and folds the F. Mouse works his way right through to Z, constructing an alphabet that surpasses even the wildest artistic imagination. A bright, beautiful concept book from best selling picture book Denise Fleming.",0,https://images.gr-assets.com/books/1312030185m/3634186.jpg,"{'Anger': 0.0, 'Anticipation': 0.30377622377622376, 'Disgust': 0.0, 'Fear': 0.12419580419580419, 'Joy': 0.29454545454545455, 'Sadness': 0.0, 'Surprise': 0.0, 'Trust': 0.2774825174825175}","{'Anger': 0.0, 'Anticipation': 0.01377782393464188, 'Disgust': 0.0, 'Fear': 0.015370235746183404, 'Joy': 0.0364523834250701, 'Sadness': 0.0, 'Surprise': 0.0, 'Trust': 0.034340706892373736, 'Objective': 0.9000588500017309}"
4,4,205,205,439341167,Scooby-Doo: Football Fright,3.0,4,163,"Scooby-Doo, that lovable and funny canine super sleuth, is a Scholastic star. The mysteries in this reading format are easy to read and fun to solve.   The Scooby-Doo Readers are a level above the Picture Clue Books. The text is easy to read and the art is bold and full-bleed, making these an appealing Level 2 reader.  Go team! Scooby loves to cheer for their favorite football team, but there's something cool about the fans at this game. Are space aliens watching the game as well? It looks like another adventure for Scooby!",32,https://covers.openlibrary.org/b/id/6560492-L.jpg,"{'Anger': 0.05539889020285636, 'Anticipation': 0.19435095060493043, 'Disgust': 0.04762121349949968, 'Fear': 0.11657418357136361, 'Joy': 0.2558901118893841, 'Sadness': 0.030610388429000268, 'Surprise': 0.07463840625852815, 'Trust': 0.22491585554443738}","{'Anger': 0.0, 'Anticipation': 0.10708916844687079, 'Disgust': 0.020709708046522668, 'Fear': 0.02411187593955218, 'Joy': 0.1273439354379302, 'Sadness': 0.013311970883772449, 'Surprise': 0.026426141308647833, 'Trust': 0.1073858691352164, 'Objective': 0.5736213308014875}"
5,5,234,234,9780689802461,Lousy Rotten Stinkin' Grapes,5.0,4,149,"Sly. Clever. Smart. That is what fox tells everyone about himself. This retelling with a slight twist of Aesop's fable ""The Fox and the Grapes"" is a delightful story for young readers. Children will love following the story of Fox's attempts to reach grapes hanging high on a vine. The beautiful color illustrations bring the story to life.",0,https://covers.openlibrary.org/b/id/9297949-L.jpg,"{'Anger': 0.6057142857142856, 'Anticipation': 0.0, 'Disgust': 0.39428571428571424, 'Fear': 0.0, 'Joy': 0.0, 'Sadness': 0.0, 'Surprise': 0.0, 'Trust': 0.0}","{'Anger': 0.029849424269264842, 'Anticipation': 0.0640980218482433, 'Disgust': 0.02536167700029525, 'Fear': 0.02353114850900502, 'Joy': 0.10817832890463537, 'Sadness': 0.01614998523767346, 'Surprise': 0.004842043105993505, 'Trust': 0.0489223501623856, 'Objective': 0.6790670209625038}"
6,6,52,52,803736800,Dragons Love Tacos,5.0,5,51,"A #1 New York Times bestselling phenomenon, this deliciously funny read-aloud from the creators of Robo-Sauce and Secret Pizza Party will make you laugh until spicy salsa comes out of your nose. Dragons love tacos. They love chicken tacos, beef tacos, great big tacos, and teeny tiny tacos. So if you want to lure a bunch of dragons to your party, you should definitely serve tacos. Buckets and buckets of tacos. Unfortunately, where there are tacos, there is also salsa. And if a dragon accidentally eats spicy salsa . . . oh, boy. You're in red-hot trouble. The award-winning team of Adam Rubin and Daniel Salmieri has created an unforgettable tale of new friends and the perfect snack.",0,https://images.gr-assets.com/books/1326100121m/13337050.jpg,"{'Anger': 0.06129643270546143, 'Anticipation': 0.12538145848679363, 'Disgust': 0.021361675260444066, 'Fear': 0.10607176681048089, 'Joy': 0.3332105650847101, 'Sadness': 0.05382510786067557, 'Surprise': 0.0912869620119962, 'Trust': 0.20756603177943808}","{'Anger': 0.008216071816854596, 'Anticipation': 0.04502531606249806, 'Disgust': 0.006305718634485757, 'Fear': 0.03131115459882583, 'Joy': 0.11024135681669929, 'Sadness': 0.015888547199701796, 'Surprise': 0.026946851800080763, 'Trust': 0.0726866088901314, 'Objective': 0.6833783741807226}"
7,7,67,67,9781512403145, Dino-racing,5.0,5,62,"In this installment of dino competition, meat eaters face off against plant
eaters in three high-speed auto events: drag racing, off-road racing, and
stock-car racing. Lisa Wheeler's rhymes explore thoughtful questions such
as: Which dinosaurs would make the best chasers for support in a desert
off-road race? Does T-Rex's king status transfer to the track? And can
Diplosaurus actually fit inside a stock car? Barry Gott's illustrations
bring all the hilarious action to life.",32,http://books.google.com/books/content?id=_HpeDAAAQBAJ&printsec=frontcover&img=1&zoom=1&edge=curl&source=gbs_api,"{'Anger': 0.09788157223072998, 'Anticipation': 0.26008167432363444, 'Disgust': 0.025906074527820316, 'Fear': 0.12557427258805512, 'Joy': 0.1735579377233282, 'Sadness': 0.04389994895354772, 'Surprise': 0.05883103624298111, 'Trust': 0.21426748340990298}","{'Anger': 0.016033949326866796, 'Anticipation': 0.042603896646876825, 'Disgust': 0.004243665858349361, 'Fear': 0.0205702817961368, 'Joy': 0.02843047077514842, 'Sadness': 0.007191236725478719, 'Surprise': 0.009637093402458401, 'Trust': 0.03509908855255456, 'Objective': 0.8361903169161301}"
8,8,182,182,9780375966699,Sleepy Hollow Sleepover,0.0,5,149,"Dink, Josh, and Ruth Rose are enjoying Halloween fun in Sleepy Hollow, New York, but when unplanned spooky things start happening, they investigate whether a real headless horseman might be to blame. Z was just the beginning! With A to Z Mysteries® Super Editions, chapter book readers keep on collecting clues and solving mysteries with Dink, Josh, and Ruth Rose. Now with over 8 million copies in print, this classic kid-favorite series is back with a bright new look! Is there a real Headless Horseman haunting Sleepy Hollow? Dink, Josh, and Ruth Rose will sleep in a cabin, take a haunted hayride, and go to a party near an old graveyard. But strange things start happening that don’t seem to be part of the spooky fun. Has the famous ghost story come to life?",0,https://covers.openlibrary.org/b/id/6454962-L.jpg,"{'Anger': 0.0692715042221268, 'Anticipation': 0.43366251610133105, 'Disgust': 0.053671103477887505, 'Fear': 0.0, 'Joy': 0.2767997710032918, 'Sadness': 0.0334907685702018, 'Surprise': 0.0492342922570488, 'Trust': 0.0838700443681122}","{'Anger': 0.006962225610633217, 'Anticipation': 0.12954918150694783, 'Disgust': 0.00539428637187491, 'Fear': 0.02629534796743289, 'Joy': 0.10591501481630655, 'Sadness': 0.01887280991973302, 'Surprise': 0.034739204234874414, 'Trust': 0.03934232860554101, 'Objective': 0.6329296009666561}"
9,9,201,201,9780062083081,Fancy Nancy: Too Many Tutus,4.0,5,161,"In this Fancy Nancy I Can Read story from New York Times bestselling team Jane O’Connor and Robin Preiss Glasser, there’s no such thing as too many tutus! Or is there? Fancy Nancy's closet is bulging (that's a fancy way of saying it won't close). Nancy's mom thinks she should give away some of her tutus—but Nancy knows a fancy girl can never have too many tutus! But when Ms. Glass tells her class they will have a fancy swap-and-shop at school, will Nancy bring in some tutus to trade? And what happens when she finds the tutu of her dreams? Fancy Nancy: Too Many Tutus is a Level One I Can Read book, which means it's perfect for children learning to sound out words and sentences. The back matter features a list of the rich vocabulary words that are used throughout the story along with their definition.",0,https://covers.openlibrary.org/b/id/7521444-L.jpg,"{'Anger': 0.0, 'Anticipation': 0.2586936522539099, 'Disgust': 0.0, 'Fear': 0.0, 'Joy': 0.3258509659613616, 'Sadness': 0.0029438822447102123, 'Surprise': 0.04029438822447102, 'Trust': 0.37221711131554736}","{'Anger': 0.0051927840945181995, 'Anticipation': 0.0814647779965699, 'Disgust': 0.0024772914946325354, 'Fear': 0.0042240995998221445, 'Joy': 0.08918249380677129, 'Sadness': 0.0037159372419488033, 'Surprise': 0.0034777361366956747, 'Trust': 0.07978149018611448, 'Objective': 0.7304833894429271}"
10,10,2,2,531088731,Zzzng! zzzng! zzzng! : a Yoruba Tale,5.0,6,2,"When Ear, Leg, and Arm refuse to marry Mosquito, she shows them that she is
not to be ignored.",32,https://covers.openlibrary.org/b/id/362878-L.jpg,"{'Anger': 0.18230509819480262, 'Anticipation': 0.11783376314223369, 'Disgust': 0.08827613568736363, 'Fear': 0.16425312438008333, 'Joy': 0.13410037690934337, 'Sadness': 0.07756397540170602, 'Surprise': 0.04800634794683595, 'Trust': 0.18766117833763143}","{'Anger': 0.11428926750404177, 'Anticipation': 0.07387140902872776, 'Disgust': 0.05534137545081457, 'Fear': 0.10297226713095385, 'Joy': 0.08406914562865314, 'Sadness': 0.04862579281183932, 'Surprise': 0.030095759233926125, 'Trust': 0.1176470588235294, 'Objective': 0.373087924387514}"
11,11,9,9,9781338055023,Rosalie the Rapunzel Fairy,5.0,6,9,"Once upon a time in Fairyland. . . . Jack Frost is up to his old tricks
again. He has sent his goblins to steal the Storybook Fairies' magic
objects -- and now readers' favorite stories are all mixed up. Rosalie's
magic hairbrush is missing-- only Rachel and Kirsty can help her get it
back!",65,https://covers.openlibrary.org/b/id/9242662-L.jpg,"{'Anger': 0.05997442455242967, 'Anticipation': 0.0, 'Disgust': 0.13580562659846548, 'Fear': 0.21649616368286448, 'Joy': 0.270076726342711, 'Sadness': 0.1758312020460358, 'Surprise': 0.079923273657289, 'Trust': 0.061892583120204604}","{'Anger': 0.019676120154388323, 'Anticipation': 0.02164792750461487, 'Disgust': 0.04455445544554456, 'Fear': 0.0710270179560329, 'Joy': 0.0886054707165632, 'Sadness': 0.05768585333109583, 'Surprise': 0.026220842423225376, 'Trust': 0.04128209431112603, 'Objective': 0.629300218157409}"
12,12,61,61,9780807534021,How to Spy on a Shark,3.0,6,57,"Spend a day at sea tracking sharks—with the help of a robot! How do you spy
on a shark? Join a team of marine biologists as they head out in their boat
to study mako sharks. They catch, tag, and release a young mako, then
follow it with a special robot that can track the shark on video! Simple,
entertaining text and bright, accurate illustrations bring science and
technology to life, and additional pages of facts about sharks follow the
story. The latest book in this read-aloud science series is bound to make a
splash with young minds!",0,https://covers.openlibrary.org/b/id/9282842-L.jpg,"{'Anger': 0.0, 'Anticipation': 0.23405313961588217, 'Disgust': 0.008558065479152154, 'Fear': 0.020201015026370787, 'Joy': 0.2925664245198527, 'Sadness': 0.0, 'Surprise': 0.1250870733406309, 'Trust': 0.3195342820181113}","{'Anger': 0.0, 'Anticipation': 0.052263182454503024, 'Disgust': 0.0019109837121969644, 'Fear': 0.004510810390418417, 'Joy': 0.06532897806812878, 'Sadness': 0.0, 'Surprise': 0.027931471235250978, 'Trust': 0.09254938559651577, 'Objective': 0.755505188542986}"
13,13,62,62,9780805075571,Vulture View,3.0,6,57,"""Turkey vultures soar on the balmy air, looking for their next stinky feast. These birds don\'t hunt--they like their food to be already dead. Vultures are part of nature\'s cleanup crew""--Inside front dust jacket.",32,https://covers.openlibrary.org/b/id/2640473-L.jpg,"{'Anger': 0.06792265741199803, 'Anticipation': 0.08907618575442078, 'Disgust': 0.20277640059494303, 'Fear': 0.2181457610312345, 'Joy': 0.23103619236489842, 'Sadness': 0.061973227565691624, 'Surprise': 0.0, 'Trust': 0.12906957527681376}","{'Anger': 0.023191513373208444, 'Anticipation': 0.030414174472407178, 'Disgust': 0.06923597788060039, 'Fear': 0.07448369258548695, 'Joy': 0.11059699808148064, 'Sadness': 0.0, 'Surprise': 0.0, 'Trust': 0.07138020539442501, 'Objective': 0.6206974382123913}"
14,14,63,63,9781584695875,There's a bug on my book!,3.0,6,58,"""Made to be read by a child while lying on the grass, a variety of insects and other creatures appear on each page. Children tip, tap, and turn pages to discover how these animals move""-- Provided by publisher.",0,http://books.google.com/books/content?id=0G0hvgAACAAJ&printsec=frontcover&img=1&zoom=1&source=gbs_api,"{'Anger': 0.09347079037800686, 'Anticipation': 0.23963344788087057, 'Disgust': 0.2506300114547537, 'Fear': 0.13516609392898055, 'Joy': 0.21351660939289804, 'Sadness': 0.06758304696449026, 'Surprise': 0.0, 'Trust': 0.0}","{'Anger': 0.024899304284145, 'Anticipation': 0.09245697546686196, 'Disgust': 0.06676431099719272, 'Fear': 0.0360063468814842, 'Joy': 0.0751861345050653, 'Sadness': 0.0, 'Surprise': 0.0, 'Trust': 0.03338215549859636, 'Objective': 0.6713047723666544}"
15,15,66,66,9780590316811,How do dinosaurs say goodnight?,5.0,6,61,"Mother and child ponder the different ways a dinosaur can say goodnight, from slamming his tail and pouting to giving a big hug and kiss.",0,https://covers.openlibrary.org/b/id/6682726-L.jpg,"{'Anger': 0.12411598302687411, 'Anticipation': 0.1933050447901933, 'Disgust': 0.0, 'Fear': 0.11044318717586044, 'Joy': 0.29691183404054694, 'Sadness': 0.01107967939651108, 'Surprise': 0.11963696369636963, 'Trust': 0.1445073078736445}","{'Anger': 0.07270091135045567, 'Anticipation': 0.11322838994752832, 'Disgust': 0.0, 'Fear': 0.06469207401270367, 'Joy': 0.173916045291356, 'Sadness': 0.0064899199116266225, 'Surprise': 0.07007732670533001, 'Trust': 0.08464512565589616, 'Objective': 0.4142502071251036}"
16,16,118,118,9781435221345,Eloise's Pirate Adventure,5.0,6,92,"Eloise loves, loves, loves dressing up as a pirate. Read along as she and
Weenie search for pirate treasure!",0,http://books.google.com/books/content?id=H6HRoAEACAAJ&printsec=frontcover&img=1&zoom=1&source=gbs_api,"{'Anger': 0.09978245105148659, 'Anticipation': 0.09398114575779552, 'Disgust': 0.0, 'Fear': 0.0, 'Joy': 0.4548223350253808, 'Sadness': 0.0, 'Surprise': 0.0, 'Trust': 0.3514140681653372}","{'Anger': 0.05783942833123161, 'Anticipation': 0.0544766708701135, 'Disgust': 0.0, 'Fear': 0.0, 'Joy': 0.2636401849516604, 'Sadness': 0.0, 'Surprise': 0.0, 'Trust': 0.2036990332072299, 'Objective': 0.42034468263976466}"
17,17,125,125,863153488,"Aunt Green, Aunt Brown and Aunt Lavender",5.0,6,100,"Classic story, perfect for fans of the Moomins, Beatrix Potter and Cicely
Mary Barker's Flower Fairies.",32,https://covers.openlibrary.org/b/id/653813-L.jpg,"{'Anger': 0.0, 'Anticipation': 0.18335393489905233, 'Disgust': 0.0, 'Fear': 0.0, 'Joy': 0.5945611866501854, 'Sadness': 0.0, 'Surprise': 0.0, 'Trust': 0.22208487845076227}","{'Anger': 0.0, 'Anticipation': 0.03894285464251335, 'Disgust': 0.0, 'Fear': 0.0, 'Joy': 0.1262798634812287, 'Sadness': 0.0, 'Surprise': 0.0, 'Trust': 0.04716898573553864, 'Objective': 0.7876082961407194}"
18,18,127,127,1423102975,My Friend Is Sad,4.0,6,100,"Gerald is careful. Piggie is not.<br />Piggie cannot help smiling. Gerald can.<br />Gerald worries so that Piggie does not have to.<br /><br />Gerald and Piggie are best friends.<br /><br />In <em>My Friend is Sad</em>, elephant Gerald is down in the dumps. Piggie is determined to cheer him up by dressing as a cowboy, a clown, and even a robot! But what does it take to make a sad elephant happy? The answer will make even pessimistic elephants smile.",64,https://s.gr-assets.com/assets/nophoto/book/111x148-bcc042a9c91a29c1d680899eff700a03.png,"{'Anger': 0.023036030714707622, 'Anticipation': 0.09864146485528649, 'Disgust': 0.0, 'Fear': 0.06571175428233907, 'Joy': 0.3286326048434731, 'Sadness': 0.183476077968104, 'Surprise': 0.07442409923213232, 'Trust': 0.2260779681039575}","{'Anger': 0.009379791359769114, 'Anticipation': 0.04016474761747287, 'Disgust': 0.0, 'Fear': 0.02675645612241831, 'Joy': 0.13381234404593692, 'Sadness': 0.06625980819529208, 'Surprise': 0.030303941316177137, 'Trust': 0.09205423443465713, 'Objective': 0.6012686769082766}"
19,19,128,128,394890485,My Father's Dragon,5.0,6,100,"A young boy recounts his father's adventures on an island where animals are
endowed with human traits.",87,https://covers.openlibrary.org/b/id/7396959-L.jpg,"{'Anger': 0.0, 'Anticipation': 0.1935733643050716, 'Disgust': 0.045296167247386755, 'Fear': 0.0, 'Joy': 0.28029423151374366, 'Sadness': 0.0, 'Surprise': 0.06349206349206347, 'Trust': 0.4173441734417344}","{'Anger': 0.0, 'Anticipation': 0.06593696426216537, 'Disgust': 0.015429249637346697, 'Fear': 0.0, 'Joy': 0.09547672425161546, 'Sadness': 0.0, 'Surprise': 0.02162732427799024, 'Trust': 0.14216009494922854, 'Objective': 0.6593696426216538}"
20,20,147,147,9780062104182,Goldilocks and the Three Dinosaurs,5.0,6,118,"Once upon a time, there were three hungry Dinosaurs: Papa Dinosaur, Mama Dinosaur . . . and a Dinosaur who happened to be visiting from Norway.<br /><br />One day--<i>for no particular reason</i>--they decided to tidy up their house, make the beds, and prepare pudding of varying temperatures. And then--<i>for no particular reason</i>--they decided to go...someplace else. They were definitely NOT setting a trap for some succulent, unsupervised little girl.<br /><br />Definitely not!<br /><br />This new take on a fairy-tale classic is so funny and so original--it could only come from the brilliant mind of Mo Willems.",40,https://covers.openlibrary.org/b/id/7271329-L.jpg,"{'Anger': 0.0, 'Anticipation': 0.34328957942673455, 'Disgust': 0.011518885614787033, 'Fear': 0.2427002410929547, 'Joy': 0.157648004286097, 'Sadness': 0.0, 'Surprise': 0.0, 'Trust': 0.24484328957942672}","{'Anger': 0.0, 'Anticipation': 0.0742249650450798, 'Disgust': 0.00207318837085965, 'Fear': 0.04368159683718239, 'Joy': 0.02837375247095126, 'Sadness': 0.0, 'Surprise': 0.0, 'Trust': 0.056120727062340295, 'Objective': 0.7955257702135866}"
21,21,172,172,375806113,Stage Fright on a Summer Night ,5.0,6,139,The show must go on!<br /><br />That's what Jack and Annie learn when the Magic Tree House whisks them back to Elizabethan England. There they meet William Shakespeare himself--one of the greatest writers of all time! But Mr. Shakespeare's having a hard time with some of the actors in his latest show. Are Jack and Annie ready to make a big entrance? Or will it be curtains for Shakespeare?,70,https://images.gr-assets.com/books/1403180055m/181396.jpg,"{'Anger': 0.0, 'Anticipation': 0.07710597826086955, 'Disgust': 0.01324728260869565, 'Fear': 0.0, 'Joy': 0.27241847826086957, 'Sadness': 0.0, 'Surprise': 0.0264945652173913, 'Trust': 0.610733695652174}","{'Anger': 0.0, 'Anticipation': 0.06570297325564023, 'Disgust': 0.0014567458538771853, 'Fear': 0.0, 'Joy': 0.029956671148961608, 'Sadness': 0.0, 'Surprise': 0.0029134917077543706, 'Trust': 0.07821604661586733, 'Objective': 0.8217540714178994}"
22,22,175,175,9781585368495,Stella Batts : Who's in Charge?,5.0,6,142,"""Stella volunteers to watch best friend Evie\'s dog, Bella, for a few days. Disaster strikes when Bella gets loose and runs away. Stella must find her before Evie returns""-- Provided by the publisher.",0,,"{'Anger': 0.16351060210908266, 'Anticipation': 0.05930377593831501, 'Disgust': 0.057602902823449376, 'Fear': 0.14888309332123825, 'Joy': 0.11191745095815854, 'Sadness': 0.0859507880712099, 'Surprise': 0.16827304683070646, 'Trust': 0.2045583399478399}","{'Anger': 0.06164237164963878, 'Anticipation': 0.04240584790321891, 'Disgust': 0.02171589791818065, 'Fear': 0.056127901508998414, 'Joy': 0.043987517633480105, 'Sadness': 0.03240285555508058, 'Surprise': 0.06343778053263797, 'Trust': 0.07981019963236866, 'Objective': 0.5984696276663959}"
23,23,179,179,9781423148135,Phineas and Ferb. Boogie Down,5.0,6,146,"The trendy dancing competition ""Let's All Dance 'Till We're Sick"" has come
to Danville, and Candace is determined that she and her crush Jeremy will
win. There's just one problem: Jeremy can't dance! So it's up to Phineas
and Ferb to teach him how to boogie. Can the boys help him dance away with
the grand prize? Featuring exciting full-color art from the show, this
World of Reading: Phineas and Ferb Level 3 early reader is perfect for fans
who are ready to read on their own.",47,https://covers.openlibrary.org/b/id/8321038-L.jpg,"{'Anger': 0.042258835366620555, 'Anticipation': 0.1507986416802918, 'Disgust': 0.06584077474531505, 'Fear': 0.08256823041126904, 'Joy': 0.28870582316689725, 'Sadness': 0.09923280090554648, 'Surprise': 0.05011948182618539, 'Trust': 0.22047541189787448}","{'Anger': 0.015993145794659432, 'Anticipation': 0.09407872816412015, 'Disgust': 0.02751201865867009, 'Fear': 0.031248512542243805, 'Joy': 0.12263791708315484, 'Sadness': 0.039792469893855015, 'Surprise': 0.03384263886905612, 'Trust': 0.08751011471274217, 'Objective': 0.5473844542814984}"
24,24,183,183,9781608182473,Mummies,5.0,6,150,"""A basic but fun exploration of mummies-preserved corpses that may be revived-including how they come to exist, their weaknesses, and memorable examples from pop culture""--Provided by publisher.",0,https://covers.openlibrary.org/b/id/8180235-L.jpg,"{'Anger': 0.0, 'Anticipation': 0.3760122565112716, 'Disgust': 0.0, 'Fear': 0.0, 'Joy': 0.2818997592471, 'Sadness': 0.0, 'Surprise': 0.1847231341650252, 'Trust': 0.15736485007660322}","{'Anger': 0.0, 'Anticipation': 0.1376770538243626, 'Disgust': 0.0, 'Fear': 0.0, 'Joy': 0.09996852376455775, 'Sadness': 0.0, 'Surprise': 0.053131885426502996, 'Trust': 0.0796978281397545, 'Objective': 0.6295247088448221}"
