,Unnamed: 0,Unnamed: 0.1,Unnamed: 0.1.1,isbn,title,rating,age,UserID,description,num_pages,image_url,emotion_NRC,emotion_NRC_objective
237,237,250,250,9780439025553,How I Survive Middle School: Can You Get an F in Lunch?,4.0,11,197,"<div>Best-selling author Nancy Krulik delves into the mind of a twelve-year-old girl just trying to survive middle school.<br /><br />After spending the night studying the Joyce Kilmer Middle School Handbook, Jenny McAfee feels totally prepared to start sixth grade. But Jenny has another reason to feel confident. She'll have her best friend, Addie Wilson, right there by her side.<br /><br />When Jenny and Addie meet at their lockers the next morning, Jenny finds out that Addie has other plans--and they don't include her. Could Addie really be ditching her for The Pops--the coolest seventh graders in the school?</div>",112,https://covers.openlibrary.org/b/id/275483-L.jpg,"{'Anger': 0.01796956176272844, 'Anticipation': 0.17242222358046577, 'Disgust': 0.022492512682598866, 'Fear': 0.06717193325591345, 'Joy': 0.15433041990098406, 'Sadness': 0.02102560968155981, 'Surprise': 0.09595990465130494, 'Trust': 0.4486278344844448}","{'Anger': 0.005408289030738949, 'Anticipation': 0.05189382093780468, 'Disgust': 0.006769559058884127, 'Fear': 0.02021669947204797, 'Joy': 0.04644874082522397, 'Sadness': 0.006328066076782987, 'Surprise': 0.028880999245782822, 'Trust': 0.13502327035926492, 'Objective': 0.6990305549934697}"
238,238,0,0,9780385903721,The Alchemyst : the Secrets of the Immortal Nicholas Flamel,0.0,12,0,"While working at pleasant but mundane summer jobs in San Francisco, fifteen-year-old twins, Sophie and Josh, suddenly find themselves caught up in the deadly, centuries-old struggle between rival alchemists, Nicholas Flamel and John Dee, over the possession of an ancient and powerful book holding the secret formulas for alchemy and everlasting life.",375,http://books.google.com/books/content?id=iTeSngEACAAJ&printsec=frontcover&img=1&zoom=1&source=gbs_api,"{'Anger': 0.1200521682425823, 'Anticipation': 0.06521030322791001, 'Disgust': 0.07799152266058038, 'Fear': 0.15076622106292792, 'Joy': 0.20691229214215845, 'Sadness': 0.08327355722204109, 'Surprise': 0.09064232148679491, 'Trust': 0.2051516139550049}","{'Anger': 0.05321885930679616, 'Anticipation': 0.02890758245887896, 'Disgust': 0.03457346862081924, 'Fear': 0.06683433064492815, 'Joy': 0.08426560286763217, 'Sadness': 0.036914982799988436, 'Surprise': 0.04018153961784175, 'Trust': 0.0769519845055358, 'Objective': 0.5781516491775792}"
239,239,26,26,9781428741126,A Wrinkle in Time ,0.0,12,26,"""Madeleine L\'Engle\'s Newbery Award-winning masterpiece has entranced young people since it was first published more than 50 years ago. With its mix of science fiction and fantas--including quantum physic--plus a strong and smart female protagonist, it holds a unique place in the annals of children\'s literature. This SparkNotes guide helps readers uncover the full richness and detail of this timeless work.""--amazon.com.",0,,"{'Anger': 0.0, 'Anticipation': 0.22803408756979135, 'Disgust': 0.010676853756489373, 'Fear': 0.019884415711627, 'Joy': 0.32598687432657464, 'Sadness': 0.009207561955137625, 'Surprise': 0.19286903712410616, 'Trust': 0.21334116955627389}","{'Anger': 0.0, 'Anticipation': 0.05701131410099426, 'Disgust': 0.0026693441739726697, 'Fear': 0.004971347406572954, 'Joy': 0.07231718665817702, 'Sadness': 0.002302003232600284, 'Surprise': 0.0482196209041485, 'Trust': 0.053337904687270406, 'Objective': 0.7591712788362639}"
240,240,27,27,9781442407688,The Unwanteds,0.0,12,27,"In a society that purges thirteen-year-olds who are creative, identical twins Aaron and Alex are separated, one to attend University while the other, supposedly Eliminated, finds himself in a wondrous place where youths hone their abilities and learn magic.",390,https://covers.openlibrary.org/b/id/7235375-L.jpg,"{'Anger': 0.009293680297397768, 'Anticipation': 0.18546055349029328, 'Disgust': 0.0, 'Fear': 0.12887236679058242, 'Joy': 0.2777777777777778, 'Sadness': 0.0, 'Surprise': 0.15654688145394463, 'Trust': 0.2420487401900041}","{'Anger': 0.0021591018136455234, 'Anticipation': 0.04308607619230401, 'Disgust': 0.0, 'Fear': 0.02993954514921793, 'Joy': 0.06453315420784955, 'Sadness': 0.0, 'Surprise': 0.036368870549851266, 'Trust': 0.05623260723539008, 'Objective': 0.7676806448517417}"
241,241,28,28,9780545667067,A Million Ways Home,0.0,12,28,"Moving in with a police detective's mother for protection after her
grandmother suffers a stroke and she witnesses an armed robbery, young
Poppy tries to manage her worries while navigating a strained new
friendship and hatching a plan to save the life of a beautiful dog. By the
author of A Smidgen of Sky. Simultaneous eBook.",242,https://covers.openlibrary.org/b/id/9633902-L.jpg,"{'Anger': 0.09506519227595313, 'Anticipation': 0.07861583319579689, 'Disgust': 0.0649172030588106, 'Fear': 0.2274852836001541, 'Joy': 0.1515651647686637, 'Sadness': 0.11888650492380481, 'Surprise': 0.009022390933597402, 'Trust': 0.25444242724321947}","{'Anger': 0.055425473907046864, 'Anticipation': 0.04583507072521411, 'Disgust': 0.0378484138948584, 'Fear': 0.1326298232671521, 'Joy': 0.08836642396638549, 'Sadness': 0.06931391731083812, 'Surprise': 0.005260288032844725, 'Trust': 0.14834653751162719, 'Objective': 0.41697405138403315}"
242,242,29,29,9780545643313,Woof : a Bowser and Birdie Novel,5.0,12,29,"[""Bowser is a mutt, just adopted by eleven-year-old Birdie Gaux and her grandmother, but when they all get home to Grammy's bait and tackle shop in the bayou they discover that their prize stuffed marlin has been stolen--so Bowser decides to investigate, and things quickly become complicated and dangerous.""]",293,http://books.google.com/books/content?id=7WjUoQEACAAJ&printsec=frontcover&img=1&zoom=1&source=gbs_api,"{'Anger': 0.2366167023554604, 'Anticipation': 0.09903640256959316, 'Disgust': 0.0, 'Fear': 0.17291220556745182, 'Joy': 0.16791577444682368, 'Sadness': 0.0, 'Surprise': 0.1465024982155603, 'Trust': 0.17701641684511063}","{'Anger': 0.05617691916624301, 'Anticipation': 0.023512963904422982, 'Disgust': 0.0, 'Fear': 0.04105236400610066, 'Joy': 0.03986612438569734, 'Sadness': 0.0, 'Surprise': 0.03478224029825453, 'Trust': 0.04202677512286053, 'Objective': 0.762582613116421}"
243,243,30,30,9781442032699,Fablehaven,5.0,12,30,"When Kendra and Seth go to stay at their grandparents' estate, they
discover that it is a sanctuary for magical creatures and that a battle
between good and evil is looming.",0,http://books.google.com/books/content?id=K9IrPwAACAAJ&printsec=frontcover&img=1&zoom=1&source=gbs_api,"{'Anger': 0.12062591350700713, 'Anticipation': 0.12492477001117704, 'Disgust': 0.1021408305390766, 'Fear': 0.19138509156564354, 'Joy': 0.157338148052618, 'Sadness': 0.10076519645774225, 'Surprise': 0.07118906370905338, 'Trust': 0.13163098615768204}","{'Anger': 0.07957574726334297, 'Anticipation': 0.08241166127843004, 'Disgust': 0.06738131699846861, 'Fear': 0.12625489195167602, 'Joy': 0.10379445295218649, 'Sadness': 0.06647382451364076, 'Surprise': 0.04696273608984176, 'Trust': 0.08683568714196585, 'Objective': 0.3403096818104475}"
244,244,31,31,9780395645666,The Giver,5.0,12,31,Includes index. Description based on print version record and CIP data provided by publisher.,180,https://covers.openlibrary.org/b/id/9306347-L.jpg,"{'Anger': 0.0, 'Anticipation': 0.0, 'Disgust': 0.0, 'Fear': 0.26621160409556316, 'Joy': 0.0, 'Sadness': 0.0, 'Surprise': 0.0, 'Trust': 0.7337883959044369}","{'Anger': 0.0, 'Anticipation': 0.04301962942579343, 'Disgust': 0.0, 'Fear': 0.014309301045679691, 'Joy': 0.0275178866263071, 'Sadness': 0.0, 'Surprise': 0.0, 'Trust': 0.0896165841130068, 'Objective': 0.8255365987892129}"
245,245,32,32,9781433690198,The Prince Warriors,4.0,12,32,"Based on Ephesians 6:10–18, The Prince Warriors is the first book in an
epic middle reader series that brings to life the invisible struggle
occurring in the spiritual realm.",288,https://covers.openlibrary.org/b/id/7414611-L.jpg,"{'Anger': 0.1561842859873829, 'Anticipation': 0.0, 'Disgust': 0.0, 'Fear': 0.2597973618810935, 'Joy': 0.16650735996941313, 'Sadness': 0.07245268591091569, 'Surprise': 0.0, 'Trust': 0.3450583062511948}","{'Anger': 0.05740987983978638, 'Anticipation': 0.0, 'Disgust': 0.0, 'Fear': 0.09549574871758837, 'Joy': 0.06120441290141241, 'Sadness': 0.026632000562153046, 'Surprise': 0.0, 'Trust': 0.12683578104138854, 'Objective': 0.6324221769376713}"
246,246,33,33,9780312367541,A Wrinkle in Time,0.0,12,33,"Meg Murry and her friends become involved with unearthly strangers and a search for Meg's father, who has disappeared while engaged in secret work for the government.",245,https://covers.openlibrary.org/b/id/6424934-L.jpg,"{'Anger': 0.0, 'Anticipation': 0.14333631484794274, 'Disgust': 0.0, 'Fear': 0.2759391771019678, 'Joy': 0.2576028622540251, 'Sadness': 0.0, 'Surprise': 0.0, 'Trust': 0.3231216457960644}","{'Anger': 0.0, 'Anticipation': 0.05587517433751743, 'Disgust': 0.0, 'Fear': 0.10756624825662484, 'Joy': 0.10041841004184102, 'Sadness': 0.0, 'Surprise': 0.0, 'Trust': 0.12595885634588563, 'Objective': 0.6101813110181311}"
247,247,34,34,9780525423843,"Theodore Boone, Kid Lawyer",5.0,12,34,"<i>A perfect murder. A faceless witness. A lone courtroom champion knows the whole truth . . . and he's only thirteen years old. Meet Theodore Boone</i><br /><br />In the small city of Strattenburg, there are many lawyers, and though he's only thirteen years old, Theo Boone thinks he's one of them. Theo knows every judge, policeman, court clerk--and a lot about the law. He dreams of being a great trial lawyer, of a life in the courtroom.<br /><br />But Theo finds himself in court much sooner than expected. Because he knows so much--maybe too much--he is suddenly dragged into the middle of a sensational murder trial. A cold-blooded killer is about to go free, and only Theo knows the truth.<br /><br />The stakes are high, but Theo won't stop until justice is served.",0,https://covers.openlibrary.org/b/id/10084993-L.jpg,"{'Anger': 0.09103205735154876, 'Anticipation': 0.12278506695522794, 'Disgust': 0.08423508724469092, 'Fear': 0.14023400513999726, 'Joy': 0.15825781144325712, 'Sadness': 0.08061679967536858, 'Surprise': 0.08504666576491274, 'Trust': 0.2377925064249966}","{'Anger': 0.04204541904851155, 'Anticipation': 0.046340549151907044, 'Disgust': 0.037203636022865715, 'Fear': 0.06477056195920407, 'Joy': 0.06211539062255959, 'Sadness': 0.0357667197700934, 'Surprise': 0.032205666448005495, 'Trust': 0.10166182488364103, 'Objective': 0.5778902320932121}"
248,248,35,35,9781501146558,Children Of Eden,5.0,12,35,"Twenty-five-year-old Joey Graceffa has captured the hearts of more than 8.3
million teens and young adults through his playful, sweet, and
inspirational YouTube presence. Already a bestselling author with his
memoir, In Real Life, Joey now presents his first novel, Children of Eden.
Rowan is a second child in a world where population control measures make
her an outlaw, marked for death. She can never go to school, make friends,
or get the eye implants that will mark her as a true member of Eden.
Indeed, her kaleidoscopic eyes may very well give her away to the ruthless
Center government. Outside of Eden, Earth is poisoned and dead. All animals
and most plants have been destroyed by a man-made catastrophe. Long ago,
the brilliant scientist Aaron Al-Baz saved a pocket of civilization by
designing the EcoPanopticon, a massive computer program that hijacked all
global technology and put it to use preserving the last vestiges of
mankind. Humans will wait for thousands of years in Eden until the EcoPan
heals the world. As an illegal second child, Rowan has been hidden away in
her family’s compound for sixteen years. Now, desperate to see the world,
she recklessly escapes for what she swears will be only one night of
adventure. Though she finds an exotic world, and even a friend, the night
leads to tragedy. Soon Rowan becomes a renegade on the run. The first novel
from YouTube superstar Joey Graceffa, Children of Eden is a thrilling and
completely absorbing new book from one of social media’s brightest young
storytellers.",278,https://covers.openlibrary.org/b/id/7878669-L.jpg,"{'Anger': 0.08733337202778262, 'Anticipation': 0.15547429721206493, 'Disgust': 0.05713235436376651, 'Fear': 0.13086462746918953, 'Joy': 0.232147348462863, 'Sadness': 0.09569137307253274, 'Surprise': 0.05939597964671967, 'Trust': 0.18196064774508103}","{'Anger': 0.03250779567762983, 'Anticipation': 0.060795483187982065, 'Disgust': 0.02126617648117875, 'Fear': 0.04871128266803017, 'Joy': 0.08303386888858483, 'Sadness': 0.039896585745252386, 'Surprise': 0.02210875780467957, 'Trust': 0.07234676902469414, 'Objective': 0.6193332805219685}"
249,249,36,36,9781250043238,Crenshaw,0.0,12,36,"""A story about a homeless boy and his imaginary friend that proves in unexpected ways that friends matter, whether real or imaginary""-- Provided by publisher.",245,https://covers.openlibrary.org/b/id/7390143-L.jpg,"{'Anger': 0.04078164825828377, 'Anticipation': 0.1050693854432172, 'Disgust': 0.078589634664401, 'Fear': 0.1304163126593033, 'Joy': 0.16624185783064285, 'Sadness': 0.10393656188048711, 'Surprise': 0.10067969413763804, 'Trust': 0.2742849051260266}","{'Anger': 0.02054354804194308, 'Anticipation': 0.08638276624580925, 'Disgust': 0.03958912903916113, 'Fear': 0.06569655467579713, 'Joy': 0.10514302018688922, 'Sadness': 0.05235751480134104, 'Surprise': 0.05071688422854697, 'Trust': 0.22291176260788928, 'Objective': 0.35665882017262285}"
250,250,37,37,9780142406632,The Ruins of Gorlan,5.0,12,37,"Alternate cover edition for ISBN: <a href=""https://www.goodreads.com/book/show/15748868-the-ruins-of-gorlan"" rel=""nofollow"">9780142406632</a> and <a href=""https://www.goodreads.com/book/show/34370991-the-ruins-of-gorlan"" rel=""nofollow"">here</a><br /><br />They have always scared him in the past -- the Rangers, with their dark cloaks and shadowy ways. The villagers believe the Rangers practice magic that makes them invisible to ordinary people. And now 15-year-old Will, always small for his age, has been chosen as a Ranger's apprentice. What he doesn't yet realize is that the Rangers are the protectors of the kingdom. Highly trained in the skills of battle and surveillance, they fight the battles before the battles reach the people. And as Will is about to learn, there is a large battle brewing. The exiled Morgarath, Lord of the Mountains of Rain and Night, is gathering his forces for an attack on the kingdom. This time, he will not be denied....",249,https://covers.openlibrary.org/b/id/6994808-L.jpg,"{'Anger': 0.16654252289357227, 'Anticipation': 0.015423038163256365, 'Disgust': 0.029443981948034877, 'Fear': 0.2107084958156246, 'Joy': 0.06493449590325548, 'Sadness': 0.1559391841563335, 'Surprise': 0.03522762125925601, 'Trust': 0.3217806598606669}","{'Anger': 0.07476543598418538, 'Anticipation': 0.01707350655992447, 'Disgust': 0.013218198627038298, 'Fear': 0.09459273392474282, 'Joy': 0.02915084875784339, 'Sadness': 0.07000531088337693, 'Surprise': 0.015814630500206536, 'Trust': 0.1542909970691792, 'Objective': 0.531088337693503}"
251,251,38,38,9781595143761,Shark Wars,3.0,12,38,"With the ocean on the brink of chaos, a young shark Gray and his best friend Barkley, exiled from the safety of their peaceful reef home, will have to battle ferocious shivers, or join them, to survive.",248,https://covers.openlibrary.org/b/id/7250557-L.jpg,"{'Anger': 0.19887194485063717, 'Anticipation': 0.08975698071164961, 'Disgust': 0.03864633382076457, 'Fear': 0.21732469883712832, 'Joy': 0.15911148248729198, 'Sadness': 0.16684074925144488, 'Surprise': 0.017408258477821875, 'Trust': 0.11203955156326162}","{'Anger': 0.12772237377577034, 'Anticipation': 0.05764500693171148, 'Disgust': 0.024819999105585622, 'Fear': 0.1395733643396986, 'Joy': 0.1021868431644381, 'Sadness': 0.10715084298555522, 'Surprise': 0.011180179777290819, 'Trust': 0.07195563704664373, 'Objective': 0.35776575287330625}"
252,252,40,40,9780316206938,I Funny : A Middle School Story,0.0,12,40,"Jamie Grimm is a middle schooler on a mission: he wants to become the world's greatest standup comedian--even if he doesn't have a lot to laugh about these days. He's new in town and stuck living with his aunt, uncle, and their evil son Stevie, a bully who doesn't let Jamie's wheelchair stop him from messing with Jamie as much as possible. But Jamie doesn't let his situation get him down. When his Uncle Frankie mentions a contest called The Planet's Funniest Kid Comic, Jamie knows he has to enter. But are the judges only rewarding him out of pity because of his wheelchair, like Stevie suggests? Will Jamie ever share the secret of his troubled past instead of hiding behind his comedy act?<br /><br />Following the bestselling success of the hilarious <i>Middle School, The Worst Years of My Life</i>, James Patterson continues to dish out the funnies in another highly-illustrated, heartfelt middle school story. (Includes more than 175 black-and-white illustrations.)<br /><br />",303,https://covers.openlibrary.org/b/id/8247103-L.jpg,"{'Anger': 0.06720987416228726, 'Anticipation': 0.10168265753820935, 'Disgust': 0.059881394339713616, 'Fear': 0.09705414396605756, 'Joy': 0.2677787956221976, 'Sadness': 0.1325394146858879, 'Surprise': 0.03466563810809508, 'Trust': 0.23918808157755173}","{'Anger': 0.017875690855699317, 'Anticipation': 0.027044355821140502, 'Disgust': 0.01592654809381532, 'Fear': 0.025813318287319028, 'Joy': 0.07842734955054306, 'Sadness': 0.03164792326532706, 'Surprise': 0.009219958196017081, 'Trust': 0.07593962786761216, 'Objective': 0.7181052280625264}"
253,253,43,43,9780786808014,Artemis Fowl,4.0,12,38,"""In 2001, audiences first met and fell in love with a twelve-year-old criminal mastermind named Artemis Fowl. Since then, the series has sold over seven million copies in the United States alone. Now, this phenomenally successful series is being translated into a graphic novel format. Eoin Colfer has teamed up with established comic writer Andrew Donkin to adapt the text. For the first time, rabid fans will be able to see what Foaly\'s tin hat looks like; discover just how ""Beet"" Root got his name; and of course, follow their favorite criminal mastermind as he plots and connives in action-packed, full-color panels""-- Provided by publisher.",281,https://covers.openlibrary.org/b/id/10195534-L.jpg,"{'Anger': 0.14044350580781412, 'Anticipation': 0.07851419342816322, 'Disgust': 0.10199391266538294, 'Fear': 0.13789676377414742, 'Joy': 0.17392384620162737, 'Sadness': 0.08870116156282996, 'Surprise': 0.0, 'Trust': 0.27852661656003475}","{'Anger': 0.04997815781383985, 'Anticipation': 0.03638746420308379, 'Disgust': 0.02656657012959697, 'Fear': 0.03591826168556959, 'Joy': 0.05318167845066092, 'Sadness': 0.013396540844888116, 'Surprise': 0.0, 'Trust': 0.10503664633455756, 'Objective': 0.6795346805378031}"
254,254,49,49,068981836X,The Call of the wild,4.0,12,48,"In this quintessential adventure story, Jack London takes readers on an arduous journey through the forbidding Alaskan landscape during the gold rush of the 1890s. Buck, a rangy mixed breed used to a comfortable, sun-filled life as a family dog, is stolen by a greedy opportunist and sold to dog traffickers. In no time, Buck finds himself on a team of sled dogs run ragged in the harsh winter of the Klondike. In a climate where every day is a savage struggle for survival, the last traces of Buck's soft, pampered existence are erased as his dormant primordial urges -- deeply embedded for generations -- are brutally awakened.",112,https://covers.openlibrary.org/b/id/9379436-L.jpg,"{'Anger': 0.1815339233038348, 'Anticipation': 0.11244837758112093, 'Disgust': 0.05067846607669616, 'Fear': 0.235929203539823, 'Joy': 0.17581120943952802, 'Sadness': 0.022359882005899705, 'Surprise': 0.07793510324483775, 'Trust': 0.14330383480825956}","{'Anger': 0.05497980916985313, 'Anticipation': 0.043276274881177856, 'Disgust': 0.015348604509881, 'Fear': 0.0714540971304006, 'Joy': 0.053246614015652366, 'Sadness': 0.0067719686952792775, 'Surprise': 0.023603616481435157, 'Trust': 0.05233534646035093, 'Objective': 0.6789836686559697}"
255,255,64,64,9780545875738,"Star Wars Jedi Academy. 4, A new class",5.0,12,59,"Excitedly embarking on his course of training at the Jedi Academy in spite
of his older sister's jealousy, Victor Starspeeder struggles with Master
Yoda's assignments, which include a requirement to join the drama club to
channel his high energy.",0,https://covers.openlibrary.org/b/id/7884225-L.jpg,"{'Anger': 0.15912171320140958, 'Anticipation': 0.0, 'Disgust': 0.1355380862022228, 'Fear': 0.09894280292762264, 'Joy': 0.2952019517484412, 'Sadness': 0.17132014095960962, 'Surprise': 0.0, 'Trust': 0.13987530496069392}","{'Anger': 0.0532549688186998, 'Anticipation': 0.0, 'Disgust': 0.022432590066849115, 'Fear': 0.016375790748799853, 'Joy': 0.04885818116559737, 'Sadness': 0.02835479384449728, 'Surprise': 0.0, 'Trust': 0.02315043294898829, 'Objective': 0.8075732424065681}"
256,256,65,65,805090053,"Girl, stolen ",5.0,12,60,"When an impulsive carjacking turns into a kidnapping, Griffin, a high school dropout, finds himself more in sympathy with his wealthy, blind victim, sixteen-year-old Cheyenne, than with his greedy father.",0,https://covers.openlibrary.org/b/id/7073849-L.jpg,"{'Anger': 0.13587243015287295, 'Anticipation': 0.0, 'Disgust': 0.0885608856088561, 'Fear': 0.1976805482340538, 'Joy': 0.03400105429625725, 'Sadness': 0.23194517659462308, 'Surprise': 0.10094886663152344, 'Trust': 0.2109910384818134}","{'Anger': 0.05546589197331611, 'Anticipation': 0.0, 'Disgust': 0.036152356358941255, 'Fear': 0.08069722401549387, 'Joy': 0.013879922530664944, 'Sadness': 0.09468474284484611, 'Surprise': 0.041209382397245524, 'Trust': 0.08613083709920379, 'Objective': 0.5917796427802883}"
257,257,74,74,9780399246265,Million-Dollar Throw,0.0,12,66,"[""Eighth-grade star quarterback Nate Brodie's family is feeling the stress of the troubled economy, and Nate is frantic because his best friend Abby is going blind, so when he gets a chance to win a million dollars if he can complete a pass during the halftime of a New England Patriot's game, he is nearly overwhelmed by the pressure to succeed.""]",0,https://covers.openlibrary.org/b/id/7311855-L.jpg,"{'Anger': 0.010197003329633738, 'Anticipation': 0.2021365149833518, 'Disgust': 0.028232519422863485, 'Fear': 0.1635682574916759, 'Joy': 0.18867924528301888, 'Sadness': 0.08559933407325193, 'Surprise': 0.1376248612652608, 'Trust': 0.18396226415094338}","{'Anger': 0.004204564956238201, 'Anticipation': 0.10233968308449172, 'Disgust': 0.014758881070876952, 'Fear': 0.0674446541959842, 'Joy': 0.09790629826668955, 'Sadness': 0.03798409701962129, 'Surprise': 0.06970425032892855, 'Trust': 0.09081288255820605, 'Objective': 0.5148446885189634}"
258,258,88,88,9780842321938,The Vanishings,5.0,12,74,"Four former Christian teenagers find themselves alone and afraid following
the Rapture when God spirits His followers away to Heaven.",0,https://covers.openlibrary.org/b/id/6522530-L.jpg,"{'Anger': 0.0, 'Anticipation': 0.20348974298514502, 'Disgust': 0.0, 'Fear': 0.11058712567790617, 'Joy': 0.32787078519217167, 'Sadness': 0.07073803348266919, 'Surprise': 0.04880924310304174, 'Trust': 0.23850506955906628}","{'Anger': 0.0, 'Anticipation': 0.1794738483934699, 'Disgust': 0.0, 'Fear': 0.09753561401684517, 'Joy': 0.26234792554850783, 'Sadness': 0.0, 'Surprise': 0.04304876780700842, 'Trust': 0.20962878236456275, 'Objective': 0.2079650618696059}"
259,259,112,112,9780399551239,Where The Red Fern Grows,5.0,12,94,"[""A young boy living in the Ozarks achieves his heart's desire when he becomes the owner of two redbone hounds and teaches them to be champion hunters.""]",304,https://covers.openlibrary.org/b/id/8137138-L.jpg,"{'Anger': 0.0, 'Anticipation': 0.19481317600786624, 'Disgust': 0.014380530973451324, 'Fear': 0.06907571288102261, 'Joy': 0.3722959685349066, 'Sadness': 0.04412487708947885, 'Surprise': 0.035521140609636175, 'Trust': 0.2697885939036381}","{'Anger': 0.0, 'Anticipation': 0.13060316413974948, 'Disgust': 0.009640738299274884, 'Fear': 0.0463085036255768, 'Joy': 0.24958800263678313, 'Sadness': 0.029581410678971652, 'Surprise': 0.023813447593935395, 'Trust': 0.18086684245220827, 'Objective': 0.3295978905735003}"
260,260,126,126,9780062102560,Survivors ,5.0,12,101,"The time has come for dogs to rule the wild.<br /> Lucky is a golden-haired mutt with a nose for survival. He has always been a loner--roaming the streets of the busy city and relying on his instincts to get by. Other dogs have Packs, but Lucky doesn't long for the days he spent with his littermates. He stands alone.<br /> Then the Big Growl strikes. Suddenly the ground is split wide open. The Trap House is destroyed. And all the longpaws have disappeared.<br /> Now Lucky is trapped in a strange and desolate new world with no food, foul water, and enemies at every turn. He falls in with others left behind, including his littermate Bella, a Leashed dog. Relying on other dogs--and having them depend on him--brings new dangers that Lucky isn't prepared for, but he may not be able to survive on his own. Can Lucky ever be a true Pack dog?",0,https://covers.openlibrary.org/b/id/9395400-L.jpg,"{'Anger': 0.1215728715728716, 'Anticipation': 0.05245310245310246, 'Disgust': 0.06875901875901877, 'Fear': 0.13704906204906206, 'Joy': 0.16190476190476194, 'Sadness': 0.1045815295815296, 'Surprise': 0.1896825396825397, 'Trust': 0.163997113997114}","{'Anger': 0.04909959787866426, 'Anticipation': 0.034617401946500384, 'Disgust': 0.02776968354799231, 'Fear': 0.05534996211900461, 'Joy': 0.06538842589894517, 'Sadness': 0.046025409406142546, 'Surprise': 0.08001631796724751, 'Trust': 0.07351827029547175, 'Objective': 0.5682149309400315}"
