,Unnamed: 0,Unnamed: 0.1,Unnamed: 0.1.1,isbn,title,rating,age,UserID,description,num_pages,image_url,emotion_NRC,emotion_NRC_objective
101,101,145,145,545132053,smile,5.0,9,116,"Raina Telgemeier's #1 <i>New York Times </i>bestselling, Eisner Award-winning graphic memoir based on her childhood!<br /><br /> Raina just wants to be a normal sixth grader. But one night after Girl Scouts she trips and falls, severely injuring her two front teeth. What follows is a long and frustrating journey with on-again, off-again braces, surgery, embarrassing headgear, and even a retainer with fake teeth attached. And on top of all that, there's still more to deal with: a major earthquake, boy confusion, and friends who turn out to be not so friendly.<br />",214,https://images.gr-assets.com/books/1438206850m/6393631.jpg,"{'Anger': 0.07129893699766658, 'Anticipation': 0.1699248120300752, 'Disgust': 0.01861550427793622, 'Fear': 0.12953072336012444, 'Joy': 0.17884366087632872, 'Sadness': 0.14975369458128082, 'Surprise': 0.11018926626912108, 'Trust': 0.17184340160746694}","{'Anger': 0.031657227057144174, 'Anticipation': 0.08751208730487636, 'Disgust': 0.008265414191647096, 'Fear': 0.05751254777363355, 'Joy': 0.07940783717824744, 'Sadness': 0.08016761062761892, 'Surprise': 0.04892480545195008, 'Trust': 0.07701339964083437, 'Objective': 0.5295390707740479}"
102,102,149,149,9780545206884,I survived the shark attacks of 1916,4.0,9,120,"In July, 1916, Chet Roscow is fascinated by news accounts of the great white shark said to be attacking people along the New Jersey shore not far from his home, but when he goes swimming in Matawan Creek he discovers the truth of the stories.",87,https://covers.openlibrary.org/b/id/7239833-L.jpg,"{'Anger': 0.11027536970933197, 'Anticipation': 0.09357470678225395, 'Disgust': 0.06973482916879144, 'Fear': 0.12544620091789904, 'Joy': 0.11996430392656807, 'Sadness': 0.12544620091789901, 'Surprise': 0.15425803161652218, 'Trust': 0.20130035696073434}","{'Anger': 0.03627747022311693, 'Anticipation': 0.030783425599731587, 'Disgust': 0.022940781748028855, 'Fear': 0.0412682435832914, 'Joy': 0.039464854890119104, 'Sadness': 0.04126824358329139, 'Surprise': 0.050746519040429455, 'Trust': 0.06622211038416374, 'Objective': 0.6710283509478275}"
103,103,150,150,590353403,Harry Potter and the Sorcerer's Stone,5.0,9,121,"Rescued from the outrageous neglect of his aunt and uncle, a young boy with
a great destiny proves his worth while attending Hogwarts School for
Witchcraft and Wizardry.",0,http://books.google.com/books/content?id=zXgTdQagLGkC&printsec=frontcover&img=1&zoom=1&source=gbs_api,"{'Anger': 0.06806879403232491, 'Anticipation': 0.18617903025279736, 'Disgust': 0.055014504765851624, 'Fear': 0.07283464566929133, 'Joy': 0.10795690012432654, 'Sadness': 0.12391214256112722, 'Surprise': 0.1513675922088686, 'Trust': 0.23466639038541234}","{'Anger': 0.04197546639407105, 'Anticipation': 0.11480960899565552, 'Disgust': 0.033925376948632756, 'Fear': 0.04491438793764375, 'Joy': 0.06657296192179912, 'Sadness': 0.07641196013289037, 'Surprise': 0.0933427038078201, 'Trust': 0.14470994122156913, 'Objective': 0.38333759263991823}"
104,104,154,154,440403278,Number The Stars,5.0,9,120,"As the German troops begin their campaign to ""relocate"" all the Jews of Denmark, Annemarie Johansen’s family takes in Annemarie’s best friend, Ellen Rosen, and conceals her as part of the family.  Through the eyes of ten-year-old Annemarie, we watch as the Danish Resistance smuggles almost the entire Jewish population of Denmark, nearly seven thousand people, across the sea to Sweden. The heroism of an entire nation reminds us that there was pride and human decency in the world even during a time of terror and war.  With a new introduction by the author.",137,https://s.gr-assets.com/assets/nophoto/book/111x148-bcc042a9c91a29c1d680899eff700a03.png,"{'Anger': 0.05870907706623805, 'Anticipation': 0.1658912105574825, 'Disgust': 0.0, 'Fear': 0.19194653582607224, 'Joy': 0.216817528127908, 'Sadness': 0.05803231537095, 'Surprise': 0.09119363844006431, 'Trust': 0.217409694611285}","{'Anger': 0.014640114758248248, 'Anticipation': 0.05225297443253735, 'Disgust': 0.0, 'Fear': 0.06773689983967597, 'Joy': 0.05406716732765168, 'Sadness': 0.006560627795122774, 'Surprise': 0.022740696987595985, 'Trust': 0.06476246730233735, 'Objective': 0.7172390515568307}"
105,105,156,156,679826424,Junie B. Jones and the Stupid Smelly Bus,5.0,9,125,"Remember when it was scary to go to school? 'Cause it was your first day and you didn't know anything. Meet Junie B. Jones, kindergartner. <i>She's</i> so scared of the school bus and the meanies on it that when it's time to go home, she doesn't.",69,https://images.gr-assets.com/books/1353109909m/958277.jpg,"{'Anger': 0.0, 'Anticipation': 0.0, 'Disgust': 0.0, 'Fear': 0.4605465151980351, 'Joy': 0.21338655204175624, 'Sadness': 0.0, 'Surprise': 0.0, 'Trust': 0.32606693276020887}","{'Anger': 0.0, 'Anticipation': 0.03615217543613817, 'Disgust': 0.0, 'Fear': 0.1050935332445877, 'Joy': 0.04869333706999229, 'Sadness': 0.0, 'Surprise': 0.0, 'Trust': 0.10943739928536399, 'Objective': 0.7006235549639179}"
106,106,159,159,9780399162541,Penelope Crumb Finds Her Luck,5.0,9,127,"[""Blaming The Bad Luck for not being anyone's Favorite, fourth-grader Penelope Crumb hopes to change this situation by becoming the lead artist for the mural her class is painting for the residents of Potwaller's Blessed Home for the Aging.""]",0,,"{'Anger': 0.09469429004547751, 'Anticipation': 0.13815058110156644, 'Disgust': 0.07741283476503286, 'Fear': 0.05790803436078828, 'Joy': 0.3183425972713492, 'Sadness': 0.0426478019201617, 'Surprise': 0.08842849924204144, 'Trust': 0.18241536129358266}","{'Anger': 0.04279515871203471, 'Anticipation': 0.06243434574103677, 'Disgust': 0.03498515642840831, 'Fear': 0.026170358529344597, 'Joy': 0.1438684631194337, 'Sadness': 0.01927380680520667, 'Surprise': 0.03996346197762046, 'Trust': 0.08243891299383423, 'Objective': 0.5480703356930806}"
107,107,161,161,590567330,A Light in the Storm : the Civil War diary of Amelia Martin,0.0,9,129,"Captures the emotions of a young Union girl who struggles to make sense of
her shattered world as she lives in a state of harsh division during the
first year of the Civil War. 120,000 first printing.",0,https://covers.openlibrary.org/b/id/6459304-L.jpg,"{'Anger': 0.0, 'Anticipation': 0.20894274968658588, 'Disgust': 0.0, 'Fear': 0.0, 'Joy': 0.3221897200167154, 'Sadness': 0.2632678646050982, 'Surprise': 0.06853322189720017, 'Trust': 0.13706644379440033}","{'Anger': 0.0, 'Anticipation': 0.032605151613955004, 'Disgust': 0.0, 'Fear': 0.06142810564069123, 'Joy': 0.05027714378871861, 'Sadness': 0.04108249103358331, 'Surprise': 0.01069448972937724, 'Trust': 0.02138897945875448, 'Objective': 0.7825236387349201}"
108,108,171,171,9781402217753,Horrid Henry,5.0,9,125,"Horrid Henry causes his brother Perfect Peter all sorts of problems when he behaves properly for a change, upstages Peter at a dance recital, plays pirates, and goes on a camping trip.",112,https://covers.openlibrary.org/b/id/7896757-L.jpg,"{'Anger': 0.15759249033683048, 'Anticipation': 0.04914411927112093, 'Disgust': 0.07156267255659857, 'Fear': 0.12909994478188846, 'Joy': 0.1639977912755384, 'Sadness': 0.22683600220872444, 'Surprise': 0.03103257868580895, 'Trust': 0.1707344008834898}","{'Anger': 0.07488848071372343, 'Anticipation': 0.023353450537916556, 'Disgust': 0.03400682235633692, 'Fear': 0.06134872736814485, 'Joy': 0.07793230123327212, 'Sadness': 0.1077932301233272, 'Surprise': 0.01474678562057203, 'Trust': 0.08113356074521123, 'Objective': 0.5247966413014957}"
109,109,176,176,9780545033503,Julia Gillian (and the Quest for Joy),5.0,9,143,"Where is the joy? Julia Gillian is sure to find it! This is the second story in an extraordinary series by a New York Times bestselling author.<br /><br />So far, fifth grade at Lake Harriet Elementary School is not exactly a thing of joy. Julia Gillian's best friend, Bonwit Keller, is keeping a secret from her. Trumpet lessons with Mr. Mixler, her favorite teacher, are much harder than expected. And most upsetting of all, the kind lunch lady has been replaced by a tyrant known as the Dumpling Man. Where is the joy? Amidst all this, Julia Gillian starts keeping secrets of her own--secrets that feel an awful lot like lies. To set things right, she will have to learn a little bit about friendship and honesty.<br />",0,https://covers.openlibrary.org/b/id/8224610-L.jpg,"{'Anger': 0.08741659098985274, 'Anticipation': 0.08820626209183877, 'Disgust': 0.07339992892960084, 'Fear': 0.07355786314999804, 'Joy': 0.21893631302562486, 'Sadness': 0.10206498993169347, 'Surprise': 0.027756939234808705, 'Trust': 0.32866111264658276}","{'Anger': 0.033725836671896665, 'Anticipation': 0.041890718540070385, 'Disgust': 0.02831812573308758, 'Fear': 0.02837905768732768, 'Joy': 0.0890977500875897, 'Sadness': 0.039377275427666156, 'Surprise': 0.010708790957697991, 'Trust': 0.13441589105366583, 'Objective': 0.5940865538409982}"
110,110,181,181,9780679890782,The Goose's Gold : an A to Z Mystery,4.0,9,148,"<b>G is for Gold...</b><br /><br />Sun, sand--and sunken treasure? That's what Dink, Josh, and Ruth Rose discover when they go on vacation to Florida. An old ship has been found off the coast, and it's full of gold! Two divers are collecting donations to bring up the loot. They're promising to share whatever they find, but is this too good to be true? It's up to Dink and his friends to get to the bottom of it! A brand-new map of the Florida coast and fun black-and-white drawings make The Goose's Gold a must for kids who love mysteries!<br /><br /><i>From the Trade Paperback edition.</i>",86,https://covers.openlibrary.org/b/id/424184-L.jpg,"{'Anger': 0.0, 'Anticipation': 0.2616671419066629, 'Disgust': 0.00855431993156544, 'Fear': 0.011880999904952002, 'Joy': 0.34730538922155696, 'Sadness': 0.04419731964642145, 'Surprise': 0.04828438361372494, 'Trust': 0.27811044577511645}","{'Anger': 0.0, 'Anticipation': 0.12525022747952685, 'Disgust': 0.004094631483166515, 'Fear': 0.005686988171064604, 'Joy': 0.14597361237488626, 'Sadness': 0.0160828025477707, 'Surprise': 0.02311191992720655, 'Trust': 0.11110100090991809, 'Objective': 0.5686988171064604}"
111,111,187,187,9781419701948,Fake Mustache,5.0,9,152,"Award-winning author Tom Angleberger flexes his comic muscle in this hairy adventure story with twists at every turn.<br /><br />Regular kid Lenny Flem Jr. is the only one standing between his evil-genius best friend--Casper, a master of disguise and hypnosis--and world domination. It all begins when Casper spends money from his granny on a spectacularly convincing fake mustache, the Heidelberg Handlebar #7. With it he's able rob banks, amass a vast fortune, and run for president. Is Lenny the only one who can see through his disguise? And will he be able to stop Casper from taking over the world?",0,https://covers.openlibrary.org/b/id/9439962-L.jpg,"{'Anger': 0.07377625892049451, 'Anticipation': 0.19162729922605284, 'Disgust': 0.07146446879083325, 'Fear': 0.08287265051763996, 'Joy': 0.21469494421549903, 'Sadness': 0.0620665393506885, 'Surprise': 0.07463061614232586, 'Trust': 0.228867222836466}","{'Anger': 0.032772456639917166, 'Anticipation': 0.0658037794460264, 'Disgust': 0.03344550867201657, 'Fear': 0.03896798688411425, 'Joy': 0.07372508413150401, 'Sadness': 0.029786866856501854, 'Surprise': 0.025627750453015793, 'Trust': 0.0785917680559151, 'Objective': 0.6212787988609889}"
112,112,188,188,9780786856299,Percy Jackson and the Lightning Thief,5.0,9,153,"Percy Jackson is a good kid, but he can't seem to focus on his schoolwork or control his temper. And lately, being away at boarding school is only getting worse-Percy could have sworn his pre-algebra teacher turned into a monster and tried to kill him. When Percy's mom finds out, she knows it's time that he knew the truth about where he came from, and that he go to the one place he'll be safe. She sends Percy to Camp Half Blood, a summer camp for demigods (on Long Island), where he learns that the father he never knew is Poseidon, God of the Sea. Soon a mystery unfolds and together with his friends -- one a satyr and the other the demigod daughter of Athena -- Percy sets out on a quest across the United States to reach the gates of the Underworld (located in a recording studio in Hollywood) and prevent a catastrophic war between the gods.",384,https://covers.openlibrary.org/b/id/7357496-L.jpg,"{'Anger': 0.06515825914935706, 'Anticipation': 0.17515661061655124, 'Disgust': 0.005481371579294428, 'Fear': 0.1304813715792944, 'Joy': 0.21867787668974611, 'Sadness': 0.05151665018133861, 'Surprise': 0.03478404220243982, 'Trust': 0.3187438180019782}","{'Anger': 0.024387610291849198, 'Anticipation': 0.07978034182760535, 'Disgust': 0.00205158264947245, 'Fear': 0.06336768063182574, 'Joy': 0.07576972912938854, 'Sadness': 0.028444499290430057, 'Surprise': 0.013019065835749983, 'Trust': 0.12701301906583573, 'Objective': 0.5861664712778428}"
113,113,214,214,9780061473791,Jake Ransom and the Skull King's Shadow,5.0,9,170,"Connecticut middle-schooler Jake and his older sister Kady are transported by a Mayan artifact to a strange world inhabited by a mix of people from long-lost civilizations who are threatened by prehistoric creatures and an evil alchemist, the Skull King.",0,https://covers.openlibrary.org/b/id/6657551-L.jpg,"{'Anger': 0.18381377397177662, 'Anticipation': 0.05837655288867446, 'Disgust': 0.21022795802677602, 'Fear': 0.23000844288988057, 'Joy': 0.0, 'Sadness': 0.18658786636111446, 'Surprise': 0.057532263900615124, 'Trust': 0.0734531419611627}","{'Anger': 0.057966604541478076, 'Anticipation': 0.03385188847894717, 'Disgust': 0.06629645125708418, 'Fear': 0.07253432733635085, 'Joy': 0.0, 'Sadness': 0.08143471149823134, 'Surprise': 0.01814309079152562, 'Trust': 0.023163820318740255, 'Objective': 0.6466091057776425}"
114,114,215,215,1575131544,Megan and the Borealis Butterfly,2.0,9,170,"Transported by the magic mirror to the Amazon rain forest, Megan meets a girl searching for specimens of an endangered species of butterfly",0,https://covers.openlibrary.org/b/id/3739736-L.jpg,"{'Anger': 0.0, 'Anticipation': 0.0, 'Disgust': 0.0, 'Fear': 0.42847811887655124, 'Joy': 0.46505551926845207, 'Sadness': 0.10646636185499675, 'Surprise': 0.0, 'Trust': 0.0}","{'Anger': 0.0, 'Anticipation': 0.0, 'Disgust': 0.0, 'Fear': 0.052350171574495244, 'Joy': 0.056819088660122904, 'Sadness': 0.013007740802809035, 'Surprise': 0.0, 'Trust': 0.0, 'Objective': 0.8778229989625728}"
115,115,226,226,9780316228190,Twilight Sparkle and the Crystal Heart Spell,5.0,9,122,"""Twilight Sparkle, a very special pony and a loyal apprentice of Princess Celestia, sets off on an adventure to find the Crystal Heart Spell and learn to be a true leader""-- Provided by publisher.",131,https://covers.openlibrary.org/b/id/None-L.jpg,"{'Anger': 0.0, 'Anticipation': 0.1285818484943211, 'Disgust': 0.0, 'Fear': 0.009794727519016357, 'Joy': 0.4106491611962071, 'Sadness': 0.0, 'Surprise': 0.05366260289673857, 'Trust': 0.3973116598937168}","{'Anger': 0.0, 'Anticipation': 0.10531197823263867, 'Disgust': 0.0, 'Fear': 0.005812874899511471, 'Joy': 0.24630511409312966, 'Sadness': 0.0, 'Surprise': 0.0318471337579618, 'Trust': 0.23968833096283473, 'Objective': 0.3710345680539237}"
116,116,229,229,9780545160452,havoc,0.0,9,182,"""Everyone knows the rumors--if you gather the right things and say the right words, you\'ll be taken to Malice, a world that exists within a terrifying comic book. Seth managed to escape from Malice, but it meant leaving his best friend, Kady, trapped there. And he\'s not sure whether he should try to take down the Malice comic from his own world or go back with an artifact he thinks can help from within. He is sure that he\'s desperate to save Kady. Meanwhile, Kady has her own battles to fight. She\'s trying to find Havoc, a rebel group of kids who want to fight Tall Jake, Malice\'s cruel overlord. But she can\'t help feeling that someone\'s watching her and that Tall Jake knows what her plans are before she puts them into action. Malice is spreading. Tall Jake is gaining influence on the world outside the comic. Seth and Kady think that if they gather the right objects and find the right people, they\'ll be able to defeat Tall Jake once and for all. The only question is...how?""--Dust cover flap.",0,https://covers.openlibrary.org/b/id/6596026-L.jpg,"{'Anger': 0.2449037641035366, 'Anticipation': 0.11725293132328311, 'Disgust': 0.02866533927499131, 'Fear': 0.27729844189500963, 'Joy': 0.07853734079201038, 'Sadness': 0.0780000632091274, 'Surprise': 0.011346038367940332, 'Trust': 0.16399608103410135}","{'Anger': 0.09350113422462475, 'Anticipation': 0.04476567401901636, 'Disgust': 0.010944061006805346, 'Fear': 0.10586900912206186, 'Joy': 0.023758386022491435, 'Sadness': 0.0263888218543366, 'Surprise': 0.00433177276895603, 'Trust': 0.05093151213861673, 'Objective': 0.6395096288430909}"
117,117,239,239,61992259,The One and Only Ivan,5.0,9,189,"Ivan is an easygoing gorilla. Living at the Exit 8 Big Top Mall and Video Arcade, he has grown accustomed to humans watching him through the glass walls of his domain. He rarely misses his life in the jungle. In fact, he hardly ever thinks about it at all.<br /><br />Instead, Ivan thinks about TV shows he's seen and about his friends Stella, an elderly elephant, and Bob, a stray dog. But mostly Ivan thinks about art and how to capture the taste of a mango or the sound of leaves with color and a well-placed line.<br /><br />Then he meets Ruby, a baby elephant taken from her family, and she makes Ivan see their home--and his own art--through new eyes. When Ruby arrives, change comes with her, and it's up to Ivan to make it a change for the better.<br /><br />Katherine Applegate blends humor and poignancy to create Ivan's unforgettable first-person narration in a story of friendship, art, and hope.",0,https://images.gr-assets.com/books/1424981397m/11594337.jpg,"{'Anger': 0.0, 'Anticipation': 0.2993654822335025, 'Disgust': 0.0, 'Fear': 0.08299492385786801, 'Joy': 0.35609137055837564, 'Sadness': 0.024048223350253806, 'Surprise': 0.023286802030456855, 'Trust': 0.21421319796954316}","{'Anger': 0.0, 'Anticipation': 0.08044344209478062, 'Disgust': 0.0, 'Fear': 0.019155292601487902, 'Joy': 0.09246675648761057, 'Sadness': 0.0055503485443149205, 'Surprise': 0.012931286977915764, 'Trust': 0.04257219846523344, 'Objective': 0.7468806748286568}"
118,118,240,240,9780060283292,If you take a mouse to school ,5.0,9,190,"If you take a mouse to school, he'll ask you for your lunch box. When you give him your lunch box, he'll want a sandwich to go in it. Then he'll need a notebook and some pencils. He'll probably want to share your backpack, too.  The famous mouse from If You Take a Mouse to the Movies and If You Give a Mouse a Cookie is back for his first day of school. Only Laura Numeroff and Felicia Bond could make school this much fun!  A perfect addition to the classic and beloved series—be sure to collect them all!",0,https://covers.openlibrary.org/b/id/24732-L.jpg,"{'Anger': 0.06915920659996488, 'Anticipation': 0.12743549236440233, 'Disgust': 0.0, 'Fear': 0.0, 'Joy': 0.42926101456907134, 'Sadness': 0.035457258206073365, 'Surprise': 0.0, 'Trust': 0.338687028260488}","{'Anger': 0.024279023909292576, 'Anticipation': 0.04473749075671679, 'Disgust': 0.0, 'Fear': 0.0, 'Joy': 0.12179566181907811, 'Sadness': 0.012447621395119545, 'Surprise': 0.0, 'Trust': 0.11889943307862953, 'Objective': 0.6778407690411634}"
119,119,252,252,375912789,Andrew lost in the bathroom,5.0,9,144,"When Andrew and Judy’s neighbor gives her dog a bath, microscopic Andrew and Judy find themselves washed off the dog and lost in the bathroom! They’ll have to use their wits–and Thudd’s storehouse of facts–if they’re to survive run-ins with mold, mildew, an ocean of soapy water, and a predatory spider on their way back to the Atom Sucker.",86,https://covers.openlibrary.org/b/id/233770-L.jpg,"{'Anger': 0.07474903474903474, 'Anticipation': 0.0433976833976834, 'Disgust': 0.16895752895752897, 'Fear': 0.13513513513513514, 'Joy': 0.22440154440154442, 'Sadness': 0.09652509652509653, 'Surprise': 0.0, 'Trust': 0.25683397683397685}","{'Anger': 0.018104963902293044, 'Anticipation': 0.010511353009389145, 'Disgust': 0.0409232035312161, 'Fear': 0.03273108143493061, 'Joy': 0.04470130550256238, 'Sadness': 0.02337934388209329, 'Surprise': 0.0, 'Trust': 0.04410279429918078, 'Objective': 0.7855459544383345}"
120,120,253,253,1593691009,The Stolen Sapphire,5.0,9,199,"Samantha and Nellie set sail for Europe aboard an ocean liner in 1906. Also traveling on the ship is a world-famous archaeologist with the legendary sapphire he discovered. Before the archaeologist can deliver his treasure to a London museum, the priceless jewel disappears. Samantha realizes that every one of the ship's first-class passengers is a suspect -- and one of them must be the thief! Can Samantha and Nellie uncover the real culprit and find the missing jewel? The book includes an illustrated ""Looking Back"" essay and a glossary of French words used in the story.",181,https://covers.openlibrary.org/b/id/871232-L.jpg,"{'Anger': 0.05694698354661792, 'Anticipation': 0.1692870201096892, 'Disgust': 0.05, 'Fear': 0.16617915904936015, 'Joy': 0.2177330895795247, 'Sadness': 0.10429616087751371, 'Surprise': 0.10703839122486289, 'Trust': 0.12851919561243144}","{'Anger': 0.014542823128457713, 'Anticipation': 0.04323163472536707, 'Disgust': 0.01276873876607764, 'Fear': 0.04243796540535493, 'Joy': 0.04958098928546418, 'Sadness': 0.026634608650995588, 'Surprise': 0.02733490510982983, 'Trust': 0.03648544550526389, 'Objective': 0.7469828894231891}"
121,121,255,255,671727516,My rotten redheaded older brother,4.0,9,201,"There's nothing worse than a rotten redheaded older brother who can do
everything you can do better! Patricia's brother Richard could run the
fastest, climb the highest, and spit the farthest and still smile his
extra-rotten, greeny-toothed, weasel-eyed grin. But when little Patricia
wishes on a shooting star that she could do something—anything—to show him
up, she finds out just what wishes—and rotten redheaded older brothers—can
really do. Patricia Polacco's boldly and exuberantly painted pictures tell
a lively and warmhearted tale of comic one-upsmanship and brotherly love.",0,https://covers.openlibrary.org/b/id/8309169-L.jpg,"{'Anger': 0.03913859875601455, 'Anticipation': 0.1008097641121934, 'Disgust': 0.0, 'Fear': 0.10456519187888745, 'Joy': 0.29474240112662836, 'Sadness': 0.09629151508038962, 'Surprise': 0.046766811407111836, 'Trust': 0.31768571763877473}","{'Anger': 0.014113415150232754, 'Anticipation': 0.03635209479475243, 'Disgust': 0.012060939483707149, 'Fear': 0.03770630554380025, 'Joy': 0.10628438425730004, 'Sadness': 0.034722809987304266, 'Surprise': 0.016864155734236136, 'Trust': 0.10710960643250104, 'Objective': 0.6347862886161658}"
122,122,256,256,60288884,The austere academy/A Series of Unfortunate Events,5.0,9,202,"Dear Listener, If you are looking for a story about cheerful youngsters spending a jolly time at boarding school, look elsewhere. Violet, Klaus, and Sunny Baudelaire are intelligent and resourceful children, and you might expect that they would do very well at school.  Don't.  For the Baudelaires, school turns out to be another miserable episode in their unlucky lives. Truth be told, within the chapters that make up this dreadful story, the children will face snapping crabs, strict punishments, dripping fungus, comprehensive exams, violin recitals, S.O.R.E., and the metric system.  It is my solemn duty to stay up all night reading my history of these three hapless youngsters into a microphone, but you may be more comfortable getting a good night's sleep. In that case, you should probably listen to something else.  With all due respect, Lemony Snicket",221,https://s.gr-assets.com/assets/nophoto/book/111x148-bcc042a9c91a29c1d680899eff700a03.png,"{'Anger': 0.07958578646290035, 'Anticipation': 0.15328406196500902, 'Disgust': 0.10505657856277925, 'Fear': 0.09131905298759865, 'Joy': 0.21182512839784542, 'Sadness': 0.09958662157083806, 'Surprise': 0.03590964132114076, 'Trust': 0.22343312873188861}","{'Anger': 0.028212377329445374, 'Anticipation': 0.0619754584881363, 'Disgust': 0.037241522225018135, 'Fear': 0.032371704732160035, 'Joy': 0.07508992140203377, 'Sadness': 0.03530247635400169, 'Surprise': 0.01272961411506979, 'Trust': 0.08059621960064536, 'Objective': 0.6364807057534896}"
123,123,258,258,9780060835217,More scary storys,4.0,9,201,"Do you like to be scared? Ellen had just fallen asleep when she heard a
strange voice. ""Ellen,"" it whispered, ""I am coming up the stairs."" Ellen
was frightened and called her parents, but they didn't hear her, and they
didn't come. . . . Welcome to the frightening world of Scary Stories, a
collection of folklorist Alvin Schwartz’s most alarming tales of horror,
dark revenge, and supernatural events of all time, with spine-tingling
illustrations by renowned artist Brett Helquist.",111,https://covers.openlibrary.org/b/id/9096870-L.jpg,"{'Anger': 0.10827947811242532, 'Anticipation': 0.13912937446652845, 'Disgust': 0.039995122546030965, 'Fear': 0.3486160224362882, 'Joy': 0.030484087306426044, 'Sadness': 0.10254846969881722, 'Surprise': 0.2090598707474698, 'Trust': 0.0218875746860139}","{'Anger': 0.0428323364846614, 'Anticipation': 0.06748022380860506, 'Disgust': 0.01582095311595601, 'Fear': 0.13790275901987264, 'Joy': 0.025612579587111717, 'Sadness': 0.04056530966621648, 'Surprise': 0.08269824426008104, 'Trust': 0.03238954273586726, 'Objective': 0.5546980513216284}"
